{
  "$schema": "https://raw.githubusercontent.com/SimonCropp/MarkdownSnippets/master/schema.json",
  "ReadOnly": false,
  "LinkFormat": "Tfs",
  "TocLevel": 3,
  "ExcludeDirectories": [ "Dir1", "Dir2" ],
  "ExcludeMarkdownDirectories": [ "Dir2", "Dir3" ],
  "ExcludeSnippetDirectories": [ "Dir4", "Dir5" ],
  "ExcludeSnippetFiles": [ "*.verified.txt", "*.received.txt" ],
  "ExcludeMarkdownFiles": [ "*.draft.md", "changelog.source.md" ],
  "UrlsAsSnippets": [ "Url1", "Url2" ],
  "TocExcludes": [ "Exclude Heading1", "Exclude Heading2" ],
  "Convention": "InPlaceOverwrite",
  "WriteHeader": true,
  "MaxWidth": 80,
  "Header": "GENERATED FILE - Source File: {relativePath}",
  "UrlPrefix": "TheUrlPrefix",
  "TreatMissingAsWarning": true,
  "ValidateContent": true,
  "OmitSnippetLinks": true
}